{"status":"warn","configurationReady":false,"checks":[{"id":"host.macos","status":"pass","summary":"macOS host detected"},{"id":"provider.codex.installed","status":"pass","summary":"codex app found at /tmp/worklouderctl-doctor-readiness-fixture-v1.2PfryJ/ChatGPT.app"},{"id":"provider.codex.version","status":"pass","summary":"codex version fixture-codex-v1"},{"id":"provider.codex.running","status":"pass","summary":"codex runtime is active"},{"id":"provider.input.installed","status":"pass","summary":"input app found at /tmp/worklouderctl-doctor-readiness-fixture-v1.2PfryJ/input.app"},{"id":"provider.input.version","status":"pass","summary":"input version fixture-input-v1"},{"id":"provider.input.running","status":"pass","summary":"input runtime is active"},{"id":"input.support-root","status":"pass","summary":"Input support root found at /tmp/worklouderctl-doctor-readiness-fixture-v1.2PfryJ/support"},{"id":"input.devices","status":"pass","summary":"1 cached device directorie(s) found"},{"id":"input.device.fixture-device.keymap","status":"pass","summary":"/tmp/worklouderctl-doctor-readiness-fixture-v1.2PfryJ/support/devices/fixture-device/keymap.json is valid JSON (sha256 1e1ad62b1a5079dfe43082d09feb36154d69783c77d466004e9a539db91747b6)"},{"id":"input.device.fixture-device.smart-actions","status":"pass","summary":"/tmp/worklouderctl-doctor-readiness-fixture-v1.2PfryJ/support/devices/fixture-device/smart_actions.json is valid JSON (sha256 ca3d163bab055381827226140568f3bef7eaac187cebd76878e0b63e9e442356)"},{"id":"input.storage","status":"pass","summary":"/tmp/worklouderctl-doctor-readiness-fixture-v1.2PfryJ/support/input_storage.json is valid JSON (sha256 ca3d163bab055381827226140568f3bef7eaac187cebd76878e0b63e9e442356)"},{"id":"provider.input.configuration-bridge","status":"warn","summary":"input configuration bridge is not discoverable at /tmp/worklouderctl-doctor-readiness-fixture-v1.2PfryJ/home/Library/Application Support/input/worklouderctl-bridge-v1.sock with token /tmp/worklouderctl-doctor-readiness-fixture-v1.2PfryJ/home/Library/Application Support/input/worklouderctl-bridge-v1.token; provider health is read-only"},{"id":"provider.codex.configuration-bridge","status":"warn","summary":"codex configuration bridge is not discoverable at /tmp/worklouderctl-doctor-readiness-fixture-v1.2PfryJ/home/Library/Application Support/Codex/worklouderctl-codex-bridge-v1.sock with token /tmp/worklouderctl-doctor-readiness-fixture-v1.2PfryJ/home/Library/Application Support/Codex/worklouderctl-codex-bridge-v1.token; provider health is read-only"}],"providers":[{"name":"codex","appPath":"/tmp/worklouderctl-doctor-readiness-fixture-v1.2PfryJ/ChatGPT.app","installed":true,"running":true,"version":"fixture-codex-v1"},{"name":"input","appPath":"/tmp/worklouderctl-doctor-readiness-fixture-v1.2PfryJ/input.app","installed":true,"running":true,"version":"fixture-input-v1"}],"inputSupportRoot":"/tmp/worklouderctl-doctor-readiness-fixture-v1.2PfryJ/support","devices":[{"id":"fixture-device","directory":"/tmp/worklouderctl-doctor-readiness-fixture-v1.2PfryJ/support/devices/fixture-device","keymapSha256":"1e1ad62b1a5079dfe43082d09feb36154d69783c77d466004e9a539db91747b6","smartActionsSha256":"ca3d163bab055381827226140568f3bef7eaac187cebd76878e0b63e9e442356"}]}
